{"$schema":"https://json-schema.org/draft/2020-12/schema","$id":"https://agent-reliability-protocol.dev/schemas/lifecycle-event-2.0.5.json","type":"object","required":["event_id","schema_version","experiment_id","run_id","episode_id","replication_id","sequence_number","checkpoint","event_type","started_at","ended_at","attributes","content_reference","parent_event_id"],"properties":{"event_id":{"type":"string","minLength":1},"schema_version":{"pattern":"^[0-9]+\\.[0-9]+\\.[0-9]+"},"experiment_id":{"type":"string","minLength":1},"run_id":{"type":"string","minLength":1},"episode_id":{"type":"string","minLength":1},"replication_id":{"type":"integer","minimum":0},"sequence_number":{"type":"integer","minimum":0},"checkpoint":{"enum":["episode.started","input.received","interpretation.completed","plan.completed","execution.started","tool.completed","retrieval.completed","artifact.completed","evaluation.completed","gate.decided","episode.completed"]},"event_type":{"enum":["episode.started","input.received","interpretation.completed","plan.completed","execution.started","tool.completed","retrieval.completed","artifact.completed","evaluation.completed","gate.decided","episode.completed"]},"started_at":{"type":"string","minLength":1},"ended_at":{"type":"string","minLength":1},"attributes":{"type":"object"},"content_reference":{"type":["string","null"]},"parent_event_id":{"type":["string","null"]}},"additionalProperties":false}
