{"event_id":"fixture-event","schema_version":"2.0.0","experiment_id":"fixture-experiment","run_id":"fixture-run","episode_id":"fixture-episode","replication_id":0,"sequence_number":1,"checkpoint":"input.received","event_type":"input.received","started_at":"2026-07-30T00:00:00+00:00","ended_at":"2026-07-30T00:00:01+00:00","attributes":{},"content_reference":null,"parent_event_id":null}
